{
  "schemaVersion": 3,
  "normalization": "shuku-epub-locator-dom-v4",
  "policyId": "shuku.reader-safety",
  "policyVersion": 5,
  "policyDigest": "3dc406a17303ec05476fddca6c161f2213494e8901ab00ffd145441428f5d79a",
  "readingOrder": [
    {
      "href": "OPS/chapter.xhtml",
      "mediaType": "application/xhtml+xml",
      "elements": [
        {
          "path": "/body[1]",
          "localName": "body"
        },
        {
          "path": "/body[1]/h1[1]",
          "localName": "h1",
          "id": "chapter-title",
          "text": "天地玄黄"
        }
      ]
    }
  ]
}
