{
  "schemaVersion": 3,
  "normalization": "shuku-epub-locator-dom-v3",
  "policyId": "shuku.reader-safety",
  "policyVersion": 2,
  "policyDigest": "d23214da7b731136eb4ce6a69a295f4a7ed8a7280cee444a6325caa77825ade2",
  "readingOrder": [
    {
      "href": "OPS/chapter.xhtml",
      "mediaType": "application/xhtml+xml",
      "elements": [
        {"path": "/body[1]", "localName": "body"},
        {"path": "/body[1]/h1[1]", "localName": "h1", "id": "chapter-title", "text": "\u5929\u5730\u7384\u9ec4"}
      ]
    }
  ]
}
